movie_id,title,release_date,original_title,omdb_title,omdb_year,omdb_rated,omdb_released,omdb_runtime,omdb_genre,omdb_director,omdb_writer,omdb_actors,omdb_plot,omdb_language,omdb_country,omdb_awards,omdb_poster,omdb_metascore,omdb_imdb_rating,omdb_imdb_votes,omdb_imdb_id,omdb_type,omdb_dvd,omdb_box_office,omdb_production,omdb_website,omdb_enriched
44,Grave of the Fireflies,1988,Grave of the Fireflies,Grave of the Fireflies,1988,Not Rated,26 Jul 1989,88 min,"Animation, Drama, War",Isao Takahata,"Akiyuki Nosaka, Isao Takahata","Tsutomu Tatsumi, Ayano Shiraishi, Akemi Yamaguchi","The story of Seita and Setsuko, two young Japanese siblings, living in the declining days of World War II. When an American firebombing separates the two children from their parents, the two siblings must rely completely on one another while they struggle to fight for their survival.",Japanese,Japan,3 wins total,https://m.media-amazon.com/images/M/MV5BNTY5MmE2OGMtN2IxNC00MDY4LTkwMGEtZDUzOTYyNWE0ZTNjXkEyXkFqcGc@._V1_SX300.jpg,94,8.5,"342,933",tt0095327,movie,N/A,"$516,962",N/A,N/A,True
45,Paths of Glory,1957,Paths of Glory,Paths of Glory,1957,Approved,25 Dec 1957,88 min,"Drama, War",Stanley Kubrick,"Stanley Kubrick, Calder Willingham, Jim Thompson","Kirk Douglas, Ralph Meeker, Adolphe Menjou",The futility and irony of the war in the trenches in WWI is shown as a unit commander in the French army must deal with the mutiny of his men and a glory-seeking general after part of his force falls back under fire in an impossible attack.,"English, German, Latin",United States,Nominated for 1 BAFTA Award5 wins & 3 nominations total,https://m.media-amazon.com/images/M/MV5BNmQ2NmI2ODYtMDQzNS00NzQyLTkzZjgtZmZlYTQ5MTc1OWU3XkEyXkFqcGc@._V1_SX300.jpg,90,8.4,"226,904",tt0050825,movie,N/A,N/A,N/A,N/A,True
46,Django Unchained,2012,Django Unchained,Django Unchained,2012,R,25 Dec 2012,165 min,"Comedy, Drama, Western",Quentin Tarantino,Quentin Tarantino,"Jamie Foxx, Christoph Waltz, Leonardo DiCaprio","In 1858, a bounty-hunter named King Schultz seeks out a slave named Django and buys him because he needs him to find some men he is looking for. After finding them, Django wants to find his wife, Broomhilda, who along with him were sold separately by his former owner for trying to escape. Schultz offers to help him if he chooses to stay with him and be his partner. Eventually they learn that she was sold to a plantation in Mississippi. Knowing they can't just go in and say they want her, they come up with a plan so that the owner will welcome them into his home and they can find a way.","English, German, French, Italian",United States,Won 2 Oscars. 58 wins & 158 nominations total,https://m.media-amazon.com/images/M/MV5BMjIyNTQ5NjQ1OV5BMl5BanBnXkFtZTcwODg1MDU4OA@@._V1_SX300.jpg,81,8.5,"1,763,019",tt1853728,movie,N/A,"$162,805,434",N/A,N/A,True
47,WALL·E,2008,WALL·E,WALL·E,2008,G,27 Jun 2008,98 min,"Animation, Adventure, Family",Andrew Stanton,"Andrew Stanton, Pete Docter, Jim Reardon","Ben Burtt, Elissa Knight, Jeff Garlin","In a distant, but not so unrealistic, future where mankind has abandoned earth because it has become covered with trash from products sold by the powerful multi-national Buy N Large corporation, WALL-E, a garbage collecting robot has been left to clean up the mess. Mesmerized with trinkets of Earth's history and show tunes, WALL-E is alone on Earth except for a sprightly pet cockroach. One day, EVE, a sleek (and dangerous) reconnaissance robot, is sent to Earth to find proof that life is once again sustainable. WALL-E falls in love with EVE. WALL-E rescues EVE from a dust storm and shows her a living plant he found amongst the rubble. Consistent with her ""directive"", EVE takes the plant and automatically enters a deactivated state except for a blinking green beacon. WALL-E, doesn't understand what has happened to his new friend, but, true to his love, he protects her from wind, rain, and lightning, even as she is unresponsive. One day a massive ship comes to reclaim EVE, but WALL-E, out of love or loneliness, hitches a ride on the outside of the ship to rescue EVE. The ship arrives back at a large space cruise ship, which is carrying all of the humans who evacuated Earth 700 years earlier. The people of Earth ride around this space resort on hovering chairs which give them a constant feed of TV and video chatting. They drink all of their meals through a straw out of laziness and/or bone loss, and are all so fat that they can barely move. When the auto-pilot computer, acting on hastily-given instructions sent many centuries before, tries to prevent the people of Earth from returning by stealing the plant, WALL-E, EVE, the portly captain, and a band of broken robots stage a mutiny.",English,"United States, Japan",Won 1 Oscar. 96 wins & 95 nominations total,https://m.media-amazon.com/images/M/MV5BMjExMTg5OTU0NF5BMl5BanBnXkFtZTcwMjMxMzMzMw@@._V1_SX300.jpg,95,8.4,"1,265,242",tt0910970,movie,N/A,"$223,808,164",N/A,N/A,True
48,The Shining,1980,The Shining,The Shining,1980,R,13 Jun 1980,146 min,"Drama, Horror",Stanley Kubrick,"Stephen King, Stanley Kubrick, Diane Johnson","Jack Nicholson, Shelley Duvall, Danny Lloyd","Haunted by a persistent writer's block, the aspiring author and recovering alcoholic, Jack Torrance, drags his wife, Wendy, and his gifted son, Danny, up snow-capped Colorado's secluded Overlook Hotel after taking up a job as an off-season caretaker. As the cavernous hotel shuts down for the season, the manager gives Jack a grand tour, and the facility's chef, the ageing Mr Hallorann, has a fascinating chat with Danny about a rare psychic gift called ""The Shining"", making sure to warn him about the hotel's abandoned rooms, and, in particular, the off-limits Room 237. However, instead of overcoming the dismal creative rut, little by little, Jack starts losing his mind, trapped in an unforgiving environment of seemingly endless snowstorms, and a gargantuan silent prison riddled with strange occurrences and eerie visions. Now, the incessant voices inside Jack's head demand sacrifice. Is Jack capable of murder?",English,"United Kingdom, United States",6 wins & 9 nominations total,https://m.media-amazon.com/images/M/MV5BNmM5ZThhY2ItOGRjOS00NzZiLWEwYTItNDgyMjFkOTgxMmRiXkEyXkFqcGc@._V1_SX300.jpg,68,8.4,"1,166,829",tt0081505,movie,N/A,"$45,634,352",N/A,N/A,True
49,3 Idiots,2009,3 Idiots,3 Idiots,2009,PG-13,25 Dec 2009,170 min,"Comedy, Drama",Rajkumar Hirani,"Abhijat Joshi, Rajkumar Hirani, Vidhu Vinod Chopra","Aamir Khan, Madhavan, Mona Singh","Farhan Qureshi and Raju Rastogi want to re-unite with their fellow collegian, Rancho, after faking a stroke aboard an Air India plane, and excusing himself from his wife - trouser less - respectively. Enroute, they encounter another student, Chatur Ramalingam, now a successful businessman, who reminds them of a bet they had undertaken 10 years ago. The trio, while recollecting hilarious antics, including their run-ins with the Dean of Delhi's Imperial College of Engineering, Viru Sahastrabudhe, race to locate Rancho, at his last known address - little knowing the secret that was kept from them all this time.","Hindi, English",India,64 wins & 30 nominations total,https://m.media-amazon.com/images/M/MV5BNzc4ZWQ3NmYtODE0Ny00YTQ4LTlkZWItNTBkMGQ0MmUwMmJlXkEyXkFqcGc@._V1_SX300.jpg,67,8.4,"460,337",tt1187043,movie,N/A,"$6,532,874",N/A,N/A,True
50,Inglourious Basterds,2009,Inglourious Basterds,Inglourious Basterds,2009,R,21 Aug 2009,153 min,"Adventure, Drama, War",Quentin Tarantino,Quentin Tarantino,"Brad Pitt, Diane Kruger, Eli Roth","In German-occupied France, young Jewish refugee Shosanna Dreyfus witnesses the slaughter of her family by Colonel Hans Landa. Narrowly escaping with her life, she plots her revenge several years later when German war hero Fredrick Zoller takes a rapid interest in her and arranges an illustrious movie premiere at the theater she now runs. With the promise of every major Nazi officer in attendance, the event catches the attention of the ""Basterds"", a group of Jewish-American guerrilla soldiers led by the ruthless Lt. Aldo Raine. As the relentless executioners advance and the conspiring young girl's plans are set in motion, their paths will cross for a fateful evening that will shake the very annals of history.","English, German, French, Italian","United States, Germany",Won 1 Oscar. 134 wins & 173 nominations total,https://m.media-amazon.com/images/M/MV5BODZhMWJlNjYtNDExNC00MTIzLTllM2ItOGQ2NGVjNDQ3MzkzXkEyXkFqcGc@._V1_SX300.jpg,69,8.4,"1,688,376",tt0361748,movie,N/A,"$120,540,719",N/A,N/A,True
51,Terminator 2: Judgment Day,1991,Terminator 2: Judgment Day,Terminator 2: Judgment Day,1991,R,03 Jul 1991,137 min,"Action, Adventure, Sci-Fi",James Cameron,"James Cameron, William Wisher","Arnold Schwarzenegger, Linda Hamilton, Edward Furlong","Over 10 years have passed since the first machine called The Terminator tried to kill Sarah Connor and her unborn son, John. The man who will become the future leader of the human resistance against the Machines is now a healthy young boy. However, another Terminator, called the T-1000, is sent back through time by the supercomputer Skynet. This new Terminator is more advanced and more powerful than its predecessor and its mission is to kill John Connor when he's still a child. However, Sarah and John do not have to face the threat of the T-1000 alone. Another Terminator (identical to the same model that tried and failed to kill Sarah Connor in 1984) is also sent back through time to protect them. Now, the battle for tomorrow has begun.","English, Spanish","United States, France",Won 4 Oscars. 39 wins & 33 nominations total,https://m.media-amazon.com/images/M/MV5BNGMyMGNkMDUtMjc2Ni00NWFlLTgyODEtZTY2MzBiZTg0OWZiXkEyXkFqcGc@._V1_SX300.jpg,75,8.6,"1,236,678",tt0103064,movie,N/A,"$205,881,154",N/A,N/A,True
52,Back to the Future,1985,Back to the Future,Back to the Future,1985,PG,03 Jul 1985,116 min,"Adventure, Comedy, Sci-Fi",Robert Zemeckis,"Robert Zemeckis, Bob Gale","Michael J. Fox, Christopher Lloyd, Lea Thompson","Marty McFly, a typical American teenager of the Eighties, is accidentally sent back to 1955 in a plutonium-powered DeLorean ""time machine"" invented by a slightly mad scientist. During his often hysterical, always amazing trip back in time, Marty must make certain his teenage parents-to-be meet and fall in love - so he can get back to the future.",English,United States,Won 1 Oscar. 27 wins & 25 nominations total,https://m.media-amazon.com/images/M/MV5BZmM3ZjE0NzctNjBiOC00MDZmLTgzMTUtNGVlOWFlOTNiZDJiXkEyXkFqcGc@._V1_SX300.jpg,87,8.5,"1,383,116",tt0088763,movie,N/A,"$214,553,307",N/A,N/A,True
53,Aliens,1986,Aliens,Aliens,1986,R,18 Jul 1986,137 min,"Action, Adventure, Horror",James Cameron,"James Cameron, David Giler, Walter Hill","Sigourney Weaver, Michael Biehn, Carrie Henn","57 years after Ellen Ripley had a close encounter with the reptilian alien creature from the first movie, she is called back, this time, to help a group of highly trained colonial marines fight off against the sinister extraterrestrials. But this time, the aliens have taken over a space colony on the moon LV-426. When the colonial marines are called upon to search the deserted space colony, they later find out that they are up against more than what they bargained for. Using specially modified machine guns and enough firepower, it's either fight or die as the space marines battle against the aliens. As the Marines do their best to defend themselves, Ripley must attempt to protect a young girl who is the sole survivor of the nearly wiped out space colony.","English, Spanish","United Kingdom, United States",Won 2 Oscars. 20 wins & 25 nominations total,https://m.media-amazon.com/images/M/MV5BZjIyNGJhYzYtN2I1My00OTVhLWEyMzItZTVjNDMzOTVkYWViXkEyXkFqcGc@._V1_SX300.jpg,84,8.4,"810,938",tt0090605,movie,N/A,"$85,160,248",N/A,N/A,True
54,The Avengers,2012,The Avengers,The Avengers,2012,PG-13,04 May 2012,143 min,"Action, Sci-Fi",Joss Whedon,"Joss Whedon, Zak Penn","Robert Downey Jr., Chris Evans, Scarlett Johansson","Loki, the adopted brother of Thor, teams-up with the Chitauri Army and uses the Tesseract's power to travel from Asgard to Midgard to plot the invasion of Earth and become a king. The director of the agency S.H.I.E.L.D., Nick Fury, sets in motion project Avengers, joining Tony Stark a.k.a. the Iron Man; Steve Rogers, a.k.a. Captain America; Bruce Banner, a.k.a. The Hulk; Thor; Natasha Romanoff, a.k.a. Black Widow; and Clint Barton, a.k.a. Hawkeye, to save the world from the powerful Loki and the alien invasion.","English, Russian",United States,Nominated for 1 Oscar. 39 wins & 81 nominations total,https://m.media-amazon.com/images/M/MV5BNGE0YTVjNzUtNzJjOS00NGNlLTgxMzctZTY4YTE1Y2Y1ZTU4XkEyXkFqcGc@._V1_SX300.jpg,69,8.0,"1,511,483",tt0848228,movie,N/A,"$623,357,910",N/A,N/A,True
55,Mad Max: Fury Road,2015,Mad Max: Fury Road,Mad Max: Fury Road,2015,R,15 May 2015,120 min,"Action, Adventure, Sci-Fi",George Miller,"George Miller, Brendan McCarthy, Nick Lathouris","Tom Hardy, Charlize Theron, Nicholas Hoult","An apocalyptic story set in the furthest reaches of our planet, in a stark desert landscape where humanity is broken, and almost everyone is crazed fighting for the necessities of life. Within this world exist two rebels on the run who just might be able to restore order. There's Max, a man of action and a man of few words, who seeks peace of mind following the loss of his wife and child in the aftermath of the chaos. And Furiosa, a woman of action and a woman who believes her path to survival may be achieved if she can make it across the desert back to her childhood homeland.","English, Russian","Australia, United States",Won 6 Oscars. 245 wins & 234 nominations total,https://m.media-amazon.com/images/M/MV5BZDRkODJhOTgtOTc1OC00NTgzLTk4NjItNDgxZDY4YjlmNDY2XkEyXkFqcGc@._V1_SX300.jpg,90,8.1,"1,168,249",tt1392190,movie,N/A,"$154,280,290",N/A,N/A,True
56,Die Hard,1988,Die Hard,Die Hard,1988,R,20 Jul 1988,132 min,"Action, Thriller",John McTiernan,"Roderick Thorp, Jeb Stuart, Steven E. de Souza","Bruce Willis, Alan Rickman, Bonnie Bedelia","NYPD cop John McClane goes on a Christmas vacation to visit his wife Holly in Los Angeles where she works for the Nakatomi Corporation. While they are at the Nakatomi headquarters for a Christmas party, a group of robbers led by Hans Gruber take control of the building and hold everyone hostage, with the exception of John, while they plan to perform a lucrative heist. Unable to escape and with no immediate police response, John is forced to take matters into his own hands.","English, German, Italian, Japanese",United States,Nominated for 4 Oscars. 8 wins & 8 nominations total,https://m.media-amazon.com/images/M/MV5BMGNlYmM1NmQtYWExMS00NmRjLTg5ZmEtMmYyYzJkMzljYWMxXkEyXkFqcGc@._V1_SX300.jpg,72,8.2,"992,832",tt0095016,movie,N/A,"$85,892,546",N/A,N/A,True
57,Raiders of the Lost Ark,1981,Raiders of the Lost Ark,Raiders of the Lost Ark,1981,PG,12 Jun 1981,115 min,"Action, Adventure",Steven Spielberg,"Lawrence Kasdan, George Lucas, Philip Kaufman","Harrison Ford, Karen Allen, Paul Freeman","The year is 1936. An archeology professor named Indiana Jones is venturing in the jungles of South America searching for a golden statue. Unfortunately, he sets off a deadly trap but miraculously escapes. Then, Jones hears from a museum curator named Marcus Brody about a biblical artifact called The Ark of the Covenant, which can hold the key to human existence. Jones has to venture to vast places such as Nepal and Egypt to find this artifact. However, he will have to fight his enemy Rene Belloq and a band of Nazis in order to reach it.","English, German, Spanish, Nepali, Hebrew, Arabic",United States,Won 4 Oscars. 41 wins & 24 nominations total,https://m.media-amazon.com/images/M/MV5BOGNhMjg2ZjgtYzk4Ni00MTViLTg1MmUtYzM2MDZiYjZlMmU3XkEyXkFqcGc@._V1_SX300.jpg,86,8.4,"1,077,681",tt0082971,movie,N/A,"$248,159,971",N/A,N/A,True
58,Heat,1995,Heat,Heat,1995,R,15 Dec 1995,170 min,"Action, Crime, Drama",Michael Mann,Michael Mann,"Al Pacino, Robert De Niro, Val Kilmer","Hunters and their prey--Neil and his professional criminal crew hunt to score big money targets (banks, vaults, armored cars) and are, in turn, hunted by Lt. Vincent Hanna and his team of cops in the Robbery/Homicide police division. A botched job puts Hanna onto their trail while they regroup and try to put together one last big 'retirement' score. Neil and Vincent are similar in many ways, including their troubled personal lives. At a crucial moment in his life, Neil disobeys the dictum taught to him long ago by his criminal mentor--'Never have anything in your life that you can't walk out on in thirty seconds flat, if you spot the heat coming around the corner'--as he falls in love. Thus the stage is set for the suspenseful ending....","English, Spanish",United States,15 nominations total,https://m.media-amazon.com/images/M/MV5BMTkxYjU1OTMtYWViZC00ZjAzLWI3MDktZGQ2N2VmMjVjNDRlXkEyXkFqcGc@._V1_SX300.jpg,76,8.3,"756,740",tt0113277,movie,N/A,"$67,436,818",N/A,N/A,True
59,The Bourne Identity,2002,The Bourne Identity,The Bourne Identity,2002,PG-13,14 Jun 2002,119 min,"Action, Mystery, Thriller",Doug Liman,"Tony Gilroy, William Blake Herron, Robert Ludlum","Franka Potente, Matt Damon, Chris Cooper","When a body is recovered at sea still alive, the mystery man (Damon) seems to have forgotten everything in life, including who he was. Eventually he begins to remember smaller details in life and soon finds out that his name was Jason Bourne. What he doesn't like is the gun and fake passports belonging to him. Now Bourne, and his new friend, Marie Helena Kreutz (Potente) travel from country to country in search of his new identity. But someone is not happy to see him alive, and is frantically trying to track him down.","English, French, German, Dutch, Italian, Yoruba","Czech Republic, Germany, United States",3 wins & 6 nominations total,https://m.media-amazon.com/images/M/MV5BYTk1ZTcyMWMtMWUxYS00MmEzLTlmODYtOTk1MGRjOTg1ZjlmXkEyXkFqcGc@._V1_SX300.jpg,68,7.8,"596,003",tt0258463,movie,N/A,"$121,661,683",N/A,N/A,True
60,John Wick,2014,John Wick,John Wick,2014,R,24 Oct 2014,101 min,"Action, Crime, Thriller",Chad Stahelski,Derek Kolstad,"Keanu Reeves, Michael Nyqvist, Alfie Allen","With the untimely death of his beloved wife still bitter in his mouth, John Wick, the expert former assassin, receives one final gift from her--a precious keepsake to help John find a new meaning in life now that she is gone. But when the arrogant Russian mob prince, Iosef Tarasov, and his men pay Wick a rather unwelcome visit to rob him of his prized 1969 Mustang and his wife's present, the legendary hitman will be forced to unearth his meticulously concealed identity. Blind with revenge, John will immediately unleash a carefully orchestrated maelstrom of destruction against the sophisticated kingpin, Viggo Tarasov, and his family, who are fully aware of his lethal capacity. Now, only blood can quench the boogeyman's thirst for retribution.","English, Russian, Hungarian",United States,5 wins & 10 nominations total,https://m.media-amazon.com/images/M/MV5BMTU2NjA1ODgzMF5BMl5BanBnXkFtZTgwMTM2MTI4MjE@._V1_SX300.jpg,68,7.5,"783,681",tt2911666,movie,N/A,"$43,037,835",N/A,N/A,True
61,The Grand Budapest Hotel,2014,The Grand Budapest Hotel,The Grand Budapest Hotel,2014,R,28 Mar 2014,99 min,"Comedy, Drama",Wes Anderson,"Stefan Zweig, Wes Anderson, Hugo Guinness","Ralph Fiennes, F. Murray Abraham, Mathieu Amalric","This movie recounts the adventures of M. Gustave (Ralph Fiennes), a legendary concierge at a famous European hotel between the wars, and Zero Moustafa (Tony Revolori), the lobby boy who becomes his most trusted friend. The story involves the theft and recovery of a priceless Renaissance painting and the battle for an enormous family fortune - all against the backdrop of a suddenly and dramatically changing continent.","English, French, German","United States, Germany",Won 4 Oscars. 135 wins & 227 nominations total,https://m.media-amazon.com/images/M/MV5BMzM5NjUxOTEyMl5BMl5BanBnXkFtZTgwNjEyMDM0MDE@._V1_SX300.jpg,88,8.1,"929,508",tt2278388,movie,N/A,"$59,301,324",N/A,N/A,True
62,Some Like It Hot,1959,Some Like It Hot,Some Like It Hot,1959,Approved,19 Mar 1959,121 min,"Comedy, Music, Romance",Billy Wilder,"Billy Wilder, I.A.L. Diamond, Robert Thoeren","Marilyn Monroe, Tony Curtis, Jack Lemmon","After two Chicago musicians, Joe and Jerry, witness the the St. Valentine's Day massacre, they want to get out of town and get away from the gangster responsible, Spats Colombo. They're desperate to get a gig out of town but the only job they know of is in an all-girl band heading to Florida. They show up at the train station as Josephine and Daphne, the replacement saxophone and bass players. They certainly enjoy being around the girls, especially Sugar Kane Kowalczyk who sings and plays the ukulele. Joe in particular sets out to woo her while Jerry/Daphne is wooed by a millionaire, Osgood Fielding III. Mayhem ensues as the two men try to keep their true identities hidden and Spats Colombo and his crew show up for a meeting with several other crime lords.","English, French",United States,Won 1 Oscar. 11 wins & 13 nominations total,https://m.media-amazon.com/images/M/MV5BZTllZDYyNjEtY2RmMS00NmJhLWI4ODAtMTQ0NWFiZTJhZjA0XkEyXkFqcGc@._V1_SX300.jpg,98,8.2,"296,088",tt0053291,movie,N/A,N/A,N/A,N/A,True
63,Toy Story,1995,Toy Story,Toy Story,1995,G,22 Nov 1995,81 min,"Animation, Adventure, Comedy",John Lasseter,"John Lasseter, Pete Docter, Andrew Stanton","Tom Hanks, Tim Allen, Don Rickles","A little boy named Andy loves to be in his room, playing with his toys, especially his doll named ""Woody"". But, what do the toys do when Andy is not with them, they come to life. Woody believes that his life (as a toy) is good. However, he must worry about Andy's family moving, and what Woody does not know is about Andy's birthday party. Woody does not realize that Andy's mother gave him an action figure known as Buzz Lightyear, who does not believe that he is a toy, and quickly becomes Andy's new favorite toy. Woody, who is now consumed with jealousy, tries to get rid of Buzz. Then, both Woody and Buzz are now lost. They must find a way to get back to Andy before he moves without them, but they will have to pass through a ruthless toy killer, Sid Phillips.",English,United States,Nominated for 3 Oscars. 29 wins & 24 nominations total,https://m.media-amazon.com/images/M/MV5BZTA3OWVjOWItNjE1NS00NzZiLWE1MjgtZDZhMWI1ZTlkNzYwXkEyXkFqcGc@._V1_SX300.jpg,96,8.3,"1,126,500",tt0114709,movie,N/A,"$223,225,679",N/A,N/A,True
64,Monty Python and the Holy Grail,1975,Monty Python and the Holy Grail,Monty Python and the Holy Grail,1975,PG,18 Jul 1975,91 min,"Adventure, Comedy, Fantasy","Terry Gilliam, Terry Jones","Graham Chapman, John Cleese, Eric Idle","Graham Chapman, John Cleese, Eric Idle","History is turned on its comic head when, in tenth-century England, King Arthur travels the countryside to find knights who will join him at the Round Table in Camelot. Gathering up the men is a tale in itself but after a bit of a party at Camelot, many decide to leave only to be stopped by God, who sends them on a quest: to find the Holy Grail. After a series of individual adventures, the knights are reunited but must face a wizard named Tim the Enchanter, killer rabbits and lessons in the use of holy hand grenades. Their quest comes to an end however when the Police intervene - just what you would expect in a Monty Python movie.","English, French, Latin, Swedish",United Kingdom,2 wins & 2 nominations total,https://m.media-amazon.com/images/M/MV5BYWY4YmUzZmUtMzQ0ZS00N2Y2LWJlODQtN2IwMDc1MWQwMmU3XkEyXkFqcGc@._V1_SX300.jpg,91,8.2,"587,859",tt0071853,movie,N/A,"$2,562,392",N/A,N/A,True
65,The Big Lebowski,1998,The Big Lebowski,The Big Lebowski,1998,R,06 Mar 1998,117 min,"Comedy, Crime","Joel Coen, Ethan Coen","Ethan Coen, Joel Coen","Jeff Bridges, John Goodman, Julianne Moore","When ""the dude"" Lebowski is mistaken for a millionaire Lebowski, two thugs urinate on his rug to coerce him into paying a debt he knows nothing about. While attempting to gain recompense for the ruined rug from his wealthy counterpart, he accepts a one-time job with high pay-off. He enlists the help of his bowling buddy, Walter, a gun-toting Jewish-convert with anger issues. Deception leads to more trouble, and it soon seems that everyone from porn empire tycoons to nihilists want something from The Dude.","English, German, Hebrew, Spanish","United Kingdom, United States",5 wins & 18 nominations total,https://m.media-amazon.com/images/M/MV5BY2E3OWQ5OWYtYTRkMC00NjVjLWIzZDQtNmRmM2ZiYTIyYmYxXkEyXkFqcGc@._V1_SX300.jpg,71,8.1,"892,989",tt0118715,movie,N/A,"$19,488,923",N/A,N/A,True
66,Groundhog Day,1993,Groundhog Day,Groundhog Day,1993,PG,12 Feb 1993,101 min,"Comedy, Drama, Fantasy",Harold Ramis,"Danny Rubin, Harold Ramis","Bill Murray, Andie MacDowell, Chris Elliott","A weather man is reluctantly sent to cover a story about a weather forecasting ""rat"" (as he calls it). This is his fourth year on the story, and he makes no effort to hide his frustration. On awaking the 'following' day, he discovers that it's Groundhog Day again, and again, and again. First he uses this to his advantage, then comes the realisation that he is doomed to spend the rest of eternity in the same place, seeing the same people do the same thing every day.","English, French, Italian",United States,Won 1 BAFTA Award7 wins & 17 nominations total,https://m.media-amazon.com/images/M/MV5BOWE3MjQ3ZDAtNDQ2MC00YjBjLTk0ZWYtNjQ0YzQ4YWE3YTEyXkEyXkFqcGc@._V1_SX300.jpg,72,8.0,"719,234",tt0107048,movie,N/A,"$71,107,962",N/A,N/A,True
