movie_id,title,release_date,original_title,omdb_title,omdb_year,omdb_rated,omdb_released,omdb_runtime,omdb_genre,omdb_director,omdb_writer,omdb_actors,omdb_plot,omdb_language,omdb_country,omdb_awards,omdb_poster,omdb_metascore,omdb_imdb_rating,omdb_imdb_votes,omdb_imdb_id,omdb_type,omdb_dvd,omdb_box_office,omdb_production,omdb_website,omdb_enriched
67,Life of Brian,1979,Life of Brian,Monty Python's Life of Brian,1979,R,17 Aug 1979,94 min,Comedy,Terry Jones,"Graham Chapman, John Cleese, Terry Gilliam","Graham Chapman, John Cleese, Michael Palin","The story of Brian of Nazareth (Graham Chapman), born on the same day as Jesus of Nazareth, who takes a different path in life that leads to the same conclusion. Brian joins a political resistance movement aiming to get the Romans out of Judea. Brian scores a victory of sorts when he manages to paint political slogans on an entire wall in the city of Jerusalem. The movement is not very effective but somehow Brian becomes a prophet and gathers his own following. His fate is sealed however and he lives a very short life.","English, Latin",United Kingdom,N/A,https://m.media-amazon.com/images/M/MV5BNDMzY2E4NjEtMTJiZC00Y2UzLWFiM2MtZWVhNTg5OGQxNjk1XkEyXkFqcGc@._V1_SX300.jpg,77,8.0,"428,865",tt0079470,movie,N/A,"$20,206,622",N/A,N/A,True
68,The Princess Bride,1987,The Princess Bride,The Princess Bride,1987,PG,09 Oct 1987,98 min,"Adventure, Comedy, Family",Rob Reiner,William Goldman,"Cary Elwes, Mandy Patinkin, Robin Wright","An elderly man reads the book ""The Princess Bride"" to his sick and thus currently bedridden adolescent grandson, the reading of the book which has been passed down within the family for generations. The grandson is sure he won't like the story, with a romance at its core, he prefers something with lots of action and ""no kissing"", but he lets grandfather continue, because he doesn't want to hurt his feelings. The story centers on Buttercup, a former farm girl who has been chosen as the princess bride to Prince Humperdinck of Florian. Buttercup does not love him, she who still laments the death of her one true love, Westley, five years ago. Westley was a hired hand on the farm, his stock answer of ""as you wish"" to any request she made of him which she came to understand was his way of saying that he loved her. But Westley went away to sea, only to be killed by the Dread Pirate Roberts. On a horse ride to clear her mind of her upcoming predicament of marriage, Buttercup is kidnapped by a band of bandits: Vizzini who works on his wits, and his two associates, a giant named Fezzik who works on his brawn, and a Spaniard named Inigo Montoya, who has trained himself his entire life to be an expert swordsman. They in turn are chased by the Dread Pirate Roberts himself. But chasing them all is the Prince, and his men led by Count Tyrone Rugen. What happens to these collectives is dependent partly on Buttercup, who does not want to marry the Prince, and may see other options as lesser evils, and partly on the other motives of individuals within the groups. But a larger question is what the grandson will think of the story as it proceeds and at its end, especially as he sees justice as high a priority as action.",English,United States,Nominated for 1 Oscar. 7 wins & 11 nominations total,https://m.media-amazon.com/images/M/MV5BMjFiOTEyNGMtN2E4MC00ZjZlLTk3ZDQtNTU1ZGNiZTA1MzJlXkEyXkFqcGc@._V1_SX300.jpg,78,8.0,"466,381",tt0093779,movie,N/A,"$30,857,814",N/A,N/A,True
69,Airplane!,1980,Airplane!,Airplane!,1980,PG,02 Jul 1980,88 min,Comedy,"Jim Abrahams, David Zucker, Jerry Zucker","Jim Abrahams, David Zucker, Jerry Zucker","Robert Hays, Julie Hagerty, Leslie Nielsen","Drowning his sorrows after that botched mission during WWII, the traumatised former fighter pilot with a fear of flying, Ted Striker, still hasn't got over his old flame and flight attendant, Elaine Dickinson. Determined to win her back, Ted boards a domestic flight from Los Angeles to Chicago, only to come face-to-face with a severe case of in-flight food poisoning that is threatening everyone's lives. Now, with most of the passengers and the entire cockpit crew down with the food-borne illness, Striker has no other choice but to confront his inner demons and take over the control of the ungovernable aircraft with the help of a gruff air-traffic controller and his former commander. Can Ted land the plane and save them all?",English,United States,Nominated for 1 BAFTA Award3 wins & 7 nominations total,https://m.media-amazon.com/images/M/MV5BNGMxMDRhMjItMDNlZi00MDIzLWE5MDQtODljMDQ3MWM1Y2E4XkEyXkFqcGc@._V1_SX300.jpg,78,7.7,"272,994",tt0080339,movie,N/A,"$83,453,539",N/A,N/A,True
70,Young Frankenstein,1974,Young Frankenstein,Young Frankenstein,1974,PG,15 Dec 1974,106 min,Comedy,Mel Brooks,"Gene Wilder, Mel Brooks, Mary Shelley","Gene Wilder, Madeline Kahn, Marty Feldman","A young neurosurgeon (Gene Wilder) inherits the castle of his grandfather, the famous Dr. Victor von Frankenstein. In the castle he finds a funny hunchback called Igor, a pretty lab assistant named Inga and the old housekeeper, frau Blucher -iiiiihhh!-. Young Frankenstein believes that the work of his grandfather is only crap, but when he discovers the book where the mad doctor described his reanimation experiment, he suddenly changes his mind...","English, German",United States,Nominated for 2 Oscars. 10 wins & 8 nominations total,https://m.media-amazon.com/images/M/MV5BMTEwNjg2MjM2ODFeQTJeQWpwZ15BbWU4MDQ1MDU5OTEx._V1_SX300.jpg,83,8.0,"175,945",tt0072431,movie,N/A,"$86,273,333",N/A,N/A,True
71,2001: A Space Odyssey,1968,2001: A Space Odyssey,2001: A Space Odyssey,1968,G,12 May 1968,149 min,"Adventure, Sci-Fi",Stanley Kubrick,"Stanley Kubrick, Arthur C. Clarke","Keir Dullea, Gary Lockwood, William Sylvester","""2001"" is a story of evolution. Sometime in the distant past, someone or something nudged evolution by placing a monolith on Earth (presumably elsewhere throughout the universe as well). Evolution then enabled humankind to reach the moon's surface, where yet another monolith is found, one that signals the monolith placers that humankind has evolved that far. Now a race begins between computers (HAL) and human (Bowman) to reach the monolith placers. The winner will achieve the next step in evolution, whatever that may be.","English, Russian, French","United Kingdom, United States",Won 1 Oscar. 18 wins & 14 nominations total,https://m.media-amazon.com/images/M/MV5BNjU0NDFkMTQtZWY5OS00MmZhLTg3Y2QtZmJhMzMzMWYyYjc2XkEyXkFqcGc@._V1_SX300.jpg,84,8.3,"756,379",tt0062622,movie,N/A,"$60,481,243",N/A,N/A,True
72,Blade Runner,1982,Blade Runner,Blade Runner,1982,R,25 Jun 1982,117 min,"Action, Drama, Sci-Fi",Ridley Scott,"Hampton Fancher, David Webb Peoples, Philip K. Dick","Harrison Ford, Rutger Hauer, Sean Young","In the early twenty-first century, the Tyrell Corporation, during what was called the Nexus phase, developed robots, called ""replicants"", that were supposed to aid society, the replicants which looked and acted like humans. When the superhuman generation Nexus 6 replicants, used for dangerous off-Earth endeavors, began a mutiny on an off-Earth colony, replicants became illegal on Earth. Police units, called ""blade runners"", have the job of destroying - or in their parlance ""retiring"" - any replicant that makes its way back to or created on Earth, with anyone convicted of aiding or assisting a replicant being sentenced to death. It's now November, 2019 in Los Angeles, California. Rick Deckard, a former blade runner, is called out of retirement when four known replicants, most combat models, have made their way back to Earth, with their leader being Roy Batty. One, Leon Kowalski, tried to infiltrate his way into the Tyrell Corporation as an employee, but has since been able to escape. Beyond following Leon's trail in hopes of finding and retiring them all, Deckard believes part of what will help him is figuring out what the replicants wanted with the Tyrell Corporation in trying to infiltrate it. The answer may lie with Tyrell's fail-safe backup mechanism. Beyond tracking the four, Deckard faces a possible dilemma in encountering a fifth replicant: Rachael, who works as Tyrell's assistant. The issue is that Dr. Elden Tyrell is experimenting with her, to provide her with fake memories so as to be able to better control her. With those memories, Rachael has no idea that she is not human. The problem is not only Rachael's assistance to Deckard, but that he is beginning to develop feelings for her.","English, German, Cantonese, Japanese, Hungarian, Arabic, Korean","United States, United Kingdom",Nominated for 2 Oscars. 13 wins & 22 nominations total,https://m.media-amazon.com/images/M/MV5BOWQ4YTBmNTQtMDYxMC00NGFjLTkwOGQtNzdhNmY1Nzc1MzUxXkEyXkFqcGc@._V1_SX300.jpg,84,8.1,"856,029",tt0083658,movie,N/A,"$32,914,489",N/A,N/A,True
73,Star Wars,1977,Star Wars,Star Wars: Episode IV - A New Hope,1977,PG,25 May 1977,121 min,"Action, Adventure, Fantasy",George Lucas,George Lucas,"Mark Hamill, Harrison Ford, Carrie Fisher","The Imperial Forces, under orders from cruel Darth Vader, hold Princess Leia hostage in their efforts to quell the rebellion against the Galactic Empire. Luke Skywalker and Han Solo, captain of the Millennium Falcon, work together with the companionable droid duo R2-D2 and C-3PO to rescue the beautiful princess, help the Rebel Alliance and restore freedom and justice to the Galaxy.",English,United States,Won 6 Oscars. 70 wins & 31 nominations total,https://m.media-amazon.com/images/M/MV5BOGUwMDk0Y2MtNjBlNi00NmRiLTk2MWYtMGMyMDlhYmI4ZDBjXkEyXkFqcGc@._V1_SX300.jpg,90,8.6,"1,514,754",tt0076759,movie,N/A,"$460,998,507",N/A,N/A,True
74,E.T. the Extra-Terrestrial,1982,E.T. the Extra-Terrestrial,E.T. the Extra-Terrestrial,1982,PG,11 Jun 1982,115 min,"Adventure, Family, Sci-Fi",Steven Spielberg,Melissa Mathison,"Henry Thomas, Drew Barrymore, Peter Coyote","After a gentle alien becomes stranded on Earth, the being is discovered and befriended by a young boy named Elliott. Bringing the extraterrestrial into his suburban California house, Elliott introduces E.T., as the alien is dubbed, to his brother and his little sister, Gertie, and the children decide to keep its existence a secret. Soon, however, E.T. falls ill, resulting in government intervention and a dire situation for both Elliott and the alien.",English,United States,Won 4 Oscars. 52 wins & 38 nominations total,https://m.media-amazon.com/images/M/MV5BYTNhNmY0YWMtMTczYi00MTA0LThhMmUtMTIxYzE0Y2QwMzRlXkEyXkFqcGc@._V1_SX300.jpg,92,7.9,"453,701",tt0083866,movie,N/A,"$439,454,989",N/A,N/A,True
75,The Thing,1982,The Thing,The Thing,1982,R,25 Jun 1982,109 min,"Horror, Mystery, Sci-Fi",John Carpenter,"Bill Lancaster, John W. Campbell Jr.","Kurt Russell, Wilford Brimley, Keith David","A US research station, Antarctica, early-winter 1982. The base is suddenly buzzed by a helicopter from the nearby Norwegian research station. They are trying to kill a dog that has escaped from their base. After the destruction of the Norwegian chopper the members of the US team fly to the Norwegian base, only to discover them all dead or missing. They do find the remains of a strange creature the Norwegians burned. The Americans take it to their base and deduce that it is an alien life form. After a while it is apparent that the alien can take over and assimilate into other life forms, including humans, and can spread like a virus. This means that anyone at the base could be inhabited by The Thing, and tensions escalate.","English, Norwegian","United States, Canada",5 nominations total,https://m.media-amazon.com/images/M/MV5BYTA3NDU5MWEtNTk4Yy00ZDNkLThmZTQtMjU3ZGVhYzAyMzU4XkEyXkFqcGc@._V1_SX300.jpg,57,8.2,"498,757",tt0084787,movie,N/A,"$20,063,820",N/A,N/A,True
76,Minority Report,2002,Minority Report,Minority Report,2002,PG-13,21 Jun 2002,145 min,"Action, Crime, Mystery",Steven Spielberg,"Scott Frank, Jon Cohen, Philip K. Dick","Tom Cruise, Colin Farrell, Samantha Morton","In the year 2054 A.D. crime is virtually eliminated from Washington D.C. thanks to an elite law enforcing squad ""Precrime"". They use three gifted humans (called ""Pre-Cogs"") with special powers to see into the future and predict crimes beforehand. John Anderton heads Precrime and believes the system's flawlessness steadfastly. However one day the Pre-Cogs predict that Anderton will commit a murder himself in the next 36 hours. Worse, Anderton doesn't even know the victim. He decides to get to the mystery's core by finding out the 'minority report' which means the prediction of the female Pre-Cog Agatha that ""might"" tell a different story and prove Anderton innocent.","English, Swedish",United States,Nominated for 1 Oscar. 20 wins & 91 nominations total,https://m.media-amazon.com/images/M/MV5BYTdmNzM3YzItZTRkYS00MTY5LTg4ZmItNjFmNTk2N2Q2NmNlXkEyXkFqcGc@._V1_SX300.jpg,80,7.6,"604,072",tt0181689,movie,N/A,"$132,072,926",N/A,N/A,True
77,District 9,2009,District 9,District 9,2009,R,14 Aug 2009,112 min,"Action, Sci-Fi, Thriller",Neill Blomkamp,"Neill Blomkamp, Terri Tatchell","Sharlto Copley, David James, Jason Cope","In 1982, a massive star ship bearing a bedraggled alien population, nicknamed ""The Prawns,"" appeared over Johannesburg, South Africa. Twenty-eight years later, the initial welcome by the human population has faded. The refugee camp where the aliens were located has deteriorated into a militarized ghetto called District 9, where they are confined and exploited in squalor. In 2010, the munitions corporation, Multi-National United, is contracted to forcibly evict the population with operative Wikus van der Merwe in charge. In this operation, Wikus is exposed to a strange alien chemical and must rely on the help of his only two new 'Prawn' friends.","English, Nyanja, Afrikaans, Zulu, Xhosa, Sotho","South Africa, United States, New Zealand, Canada",Nominated for 4 Oscars. 32 wins & 117 nominations total,https://m.media-amazon.com/images/M/MV5BMTM4OTI1OTM5NF5BMl5BanBnXkFtZTcwMzk5MTU1Mg@@._V1_SX300.jpg,81,7.9,"736,708",tt1136608,movie,N/A,"$115,646,235",N/A,N/A,True
78,Ex Machina,2014,Ex Machina,Ex Machina,2014,R,24 Apr 2015,108 min,"Drama, Sci-Fi, Thriller",Alex Garland,Alex Garland,"Alicia Vikander, Domhnall Gleeson, Oscar Isaac","Caleb, a 26 year old programmer at the world's largest internet company, wins a competition to spend a week at a private mountain retreat belonging to Nathan, the reclusive CEO of the company. But when Caleb arrives at the remote location he finds that he will have to participate in a strange and fascinating experiment in which he must interact with the world's first true artificial intelligence, housed in the body of a beautiful robot girl.",English,"United Kingdom, United States",Won 1 Oscar. 74 wins & 162 nominations total,https://m.media-amazon.com/images/M/MV5BMTUxNzc0OTIxMV5BMl5BanBnXkFtZTgwNDI3NzU2NDE@._V1_SX300.jpg,78,7.7,"619,108",tt0470752,movie,N/A,"$25,442,958",N/A,N/A,True
79,Arrival,2016,Arrival,Arrival,2016,PG-13,11 Nov 2016,116 min,"Drama, Mystery, Sci-Fi",Denis Villeneuve,"Eric Heisserer, Ted Chiang","Amy Adams, Jeremy Renner, Forest Whitaker","Linguistics professor Louise Banks leads an elite team of investigators when gigantic spaceships touchdown in 12 locations around the world. As nations teeter on the verge of global war, Banks and her crew must race against time to find a way to communicate with the extraterrestrial visitors. Hoping to unravel the mystery, she takes a chance that could threaten her life and quite possibly all of mankind.","English, Mandarin, Russian","United States, Canada",Won 1 Oscar. 71 wins & 268 nominations total,https://m.media-amazon.com/images/M/MV5BMTExMzU0ODcxNDheQTJeQWpwZ15BbWU4MDE1OTI4MzAy._V1_SX300.jpg,81,7.9,"817,569",tt2543164,movie,N/A,"$100,546,139",N/A,N/A,True
80,The Martian,2015,The Martian,The Martian,2015,PG-13,02 Oct 2015,144 min,"Adventure, Drama, Sci-Fi",Ridley Scott,"Drew Goddard, Andy Weir","Matt Damon, Jessica Chastain, Kristen Wiig","During a manned mission to Mars, Astronaut Mark Watney is presumed dead after a fierce storm and left behind by his crew. But Watney has survived and finds himself stranded and alone on the hostile planet. With only meager supplies, he must draw upon his ingenuity, wit and spirit to subsist and find a way to signal to Earth that he is alive. Millions of miles away, NASA and a team of international scientists work tirelessly to bring ""the Martian"" home, while his crewmates concurrently plot a daring, if not impossible, rescue mission. As these stories of incredible bravery unfold, the world comes together to root for Watney's safe return.","English, Mandarin","United States, United Kingdom, Hungary, Jordan",Nominated for 7 Oscars. 40 wins & 199 nominations total,https://m.media-amazon.com/images/M/MV5BMTc2MTQ3MDA1Nl5BMl5BanBnXkFtZTgwODA3OTI4NjE@._V1_SX300.jpg,80,8.0,"970,330",tt3659388,movie,N/A,"$228,433,663",N/A,N/A,True
81,The Exorcist,1973,The Exorcist,The Exorcist,1973,R,26 Dec 1973,122 min,Horror,William Friedkin,William Peter Blatty,"Ellen Burstyn, Max von Sydow, Linda Blair","A visiting actress in Washington, D.C., notices dramatic and dangerous changes in the behavior and physical make-up of her 12-year-old daughter. Meanwhile, a young priest at nearby Georgetown University begins to doubt his faith while dealing with his mother's terminal sickness. And, book-ending the story, a frail, elderly priest recognizes the necessity for a show-down with an old demonic enemy.","English, Latin, Greek, French, German, Arabic, Kurdish",United States,Won 2 Oscars. 18 wins & 21 nominations total,https://m.media-amazon.com/images/M/MV5BZjg3YjE4ZjAtYTdmYS00ZTBkLWE1ZjgtNzAzODUwNzRiYjlmXkEyXkFqcGc@._V1_SX300.jpg,83,8.1,"479,788",tt0070047,movie,N/A,"$233,005,644",N/A,N/A,True
82,Psycho,1960,Psycho,Psycho,1960,R,08 Sep 1960,109 min,"Drama, Horror, Mystery",Alfred Hitchcock,"Joseph Stefano, Robert Bloch","Anthony Perkins, Janet Leigh, Vera Miles","Phoenix office worker Marion Crane is fed up with the way life has treated her. She has to meet her lover Sam in lunch breaks, and they cannot get married because Sam has to give most of his money away in alimony. One Friday, Marion is trusted to bank forty thousand dollars by her employer. Seeing the opportunity to take the money and start a new life, Marion leaves town and heads towards Sam's California store. Tired after the long drive and caught in a storm, she gets off the main highway and pulls into the Bates Motel. The motel is managed by a quiet young man called Norman who seems to be dominated by his mother.",English,United States,Nominated for 4 Oscars. 8 wins & 14 nominations total,https://m.media-amazon.com/images/M/MV5BYjZhMzFiZjItODA3ZC00MmRhLWIzMGYtMmVjOWUwYTA3MTRjXkEyXkFqcGc@._V1_SX300.jpg,97,8.5,"754,598",tt0054215,movie,N/A,"$32,181,230",N/A,N/A,True
83,Halloween,1978,Halloween,Halloween,1978,R,27 Oct 1978,91 min,"Horror, Thriller",John Carpenter,"John Carpenter, Debra Hill","Donald Pleasence, Jamie Lee Curtis, Tony Moran","The year is 1963, the night: Halloween. Police are called to 43 Lampkin Ln. only to discover that 15 year old Judith Myers has been stabbed to death, by her 6 year-old brother, Michael. After being institutionalized for 15 years, Myers breaks out on the night before Halloween. No one knows, nor wants to find out, what will happen on October 31st 1978 besides Myers' psychiatrist, Dr. Loomis. He knows Michael is coming back to Haddonfield, but by the time the town realizes it, it'll be too late for many people.",English,United States,9 wins & 3 nominations total,https://m.media-amazon.com/images/M/MV5BMzZiNTdiYTgtYjNkMS00MmJmLWEwZGQtNmY0NGJkMGE0YmYzXkEyXkFqcGc@._V1_SX300.jpg,90,7.7,"324,287",tt0077651,movie,N/A,"$47,160,000",N/A,N/A,True
84,A Nightmare on Elm Street,1984,A Nightmare on Elm Street,A Nightmare on Elm Street,1984,R,16 Nov 1984,91 min,Horror,Wes Craven,Wes Craven,"Heather Langenkamp, Johnny Depp, Robert Englund","On Elm Street, Nancy Thompson and a group of her friends (comprising Tina Gray, Rod Lane and Glen Lantz) are being tormented by a clawed killer in their dreams named Fred Krueger. Nancy must think quickly, as Fred tries to pick them off one by one. When he has you in your sleep, who is there to save you?",English,United States,7 wins & 8 nominations total,https://m.media-amazon.com/images/M/MV5BNTZmN2VlMWMtMTdlMi00NDBhLWIyODMtODEwMzM0ODMwMWYwXkEyXkFqcGc@._V1_SX300.jpg,76,7.4,"278,852",tt0087800,movie,N/A,"$25,624,448",N/A,N/A,True
85,The Texas Chain Saw Massacre,1974,The Texas Chain Saw Massacre,The Texas Chain Saw Massacre,1974,R,11 Oct 1974,83 min,Horror,Tobe Hooper,"Kim Henkel, Tobe Hooper","Marilyn Burns, Edwin Neal, Allen Danziger","En route to visit their grandfather's grave (which has apparently been ritualistically desecrated), five teenagers drive past a slaughterhouse, pick up (and quickly drop) a sinister hitch-hiker, eat some delicious home-cured meat at a roadside gas station, before ending up at the old family home... where they're plunged into a never-ending nightmare as they meet a family of cannibals who more than make up in power tools what they lack in social skills...",English,United States,4 wins & 2 nominations total,https://m.media-amazon.com/images/M/MV5BYjE1MGJkMjUtY2VkNi00N2U1LWI2NWEtMDExNGYzYjRkZTM0XkEyXkFqcGc@._V1_SX300.jpg,91,7.4,"198,129",tt0072271,movie,N/A,"$30,859,000",N/A,N/A,True
86,Rosemary's Baby,1968,Rosemary's Baby,Rosemary's Baby,1968,R,12 Jun 1968,137 min,"Drama, Horror",Roman Polanski,"Ira Levin, Roman Polanski","Mia Farrow, John Cassavetes, Ruth Gordon","Desiring to start their family, young Catholic homemaker Rosemary Woodhouse and her struggling-actor husband Guy move into The Bramford: New York City's iconic building that brims with unpleasant stories of obscure dwellers and ghastly occurrences. The young couple is soon befriended by their eccentric next-door neighbors, Roman and Minnie and Castevet; shortly afterward, Rosemary gets pregnant. However, little by little--as the inexperienced mother becomes systematically cut off from her circle of friends--alarming hints of a sinister, well-planned conspiracy start to emerge, enfolding timid Rosemary in a shroud of suspicion and mental agony. Why is everyone so conveniently eager to help? And why is Guy allowing it?",English,United States,Won 1 Oscar. 13 wins & 13 nominations total,https://m.media-amazon.com/images/M/MV5BNDlhMDI3OTQtNTBkYy00NWQ5LWJmNWEtZGQwYzZlMTQ4MDI1XkEyXkFqcGc@._V1_SX300.jpg,96,8.0,"248,328",tt0063522,movie,N/A,N/A,N/A,N/A,True
87,Get Out,2017,Get Out,Get Out,2017,R,24 Feb 2017,104 min,"Horror, Mystery, Thriller",Jordan Peele,Jordan Peele,"Daniel Kaluuya, Allison Williams, Bradley Whitford","Chris and his girlfriend Rose go upstate to visit her parents for the weekend. At first, Chris reads the family's overly accommodating behavior as nervous attempts to deal with their daughter's interracial relationship, but as the weekend progresses, a series of increasingly disturbing discoveries lead him to a truth that he never could have imagined.","English, Swahili","United States, Japan",Won 1 Oscar. 154 wins & 214 nominations total,https://m.media-amazon.com/images/M/MV5BMjUxMDQwNjcyNl5BMl5BanBnXkFtZTgwNzcwMzc0MTI@._V1_SX300.jpg,85,7.8,"762,883",tt5052448,movie,09 May 2017,"$176,196,665","Universal Pictures, QC Entertainment, Blumhouse Productions",N/A,True
88,Hereditary,2018,Hereditary,Hereditary,2018,R,08 Jun 2018,127 min,"Drama, Horror, Mystery",Ari Aster,Ari Aster,"Toni Collette, Milly Shapiro, Gabriel Byrne","When her mentally ill mother passes away, Annie (Toni Collette), her husband (Gabriel Byrne), son (Alex Wolff), and daughter (Milly Shapiro) all mourn her loss. The family turn to different means to handle their grief, including Annie and her daughter both flirting with the supernatural. They each begin to have disturbing, otherworldly experiences linked to the sinister secrets and emotional trauma that have been passed through the generations of their family.","English, Spanish",United States,52 wins & 112 nominations total,https://m.media-amazon.com/images/M/MV5BNTEyZGQwODctYWJjZi00NjFmLTg3YmEtMzlhNjljOGZhMWMyXkEyXkFqcGc@._V1_SX300.jpg,87,7.3,"423,388",tt7784604,movie,N/A,"$44,069,456",N/A,N/A,True
89,The Babadook,2014,The Babadook,The Babadook,2014,Not Rated,28 Nov 2014,94 min,"Drama, Horror, Mystery",Jennifer Kent,Jennifer Kent,"Essie Davis, Noah Wiseman, Daniel Henshall","Amelia, who lost her husband in a car crash on the way to give birth to Samuel, their only child, struggles to cope with her fate as a single mom. Samuel's constant fear of monsters and violent reaction to overcome the fear doesn't help her cause either, which makes her friends become distant. When things can not get any worse, they read a strange book in their house about the 'Babadook' monster that hides in the dark areas of their house. Even Amelia seems to feel the effect of Babadook and desperately tries in vain to destroy the book. The nightmarish experiences the two encounter form the rest of the story.",English,"Australia, Canada",56 wins & 64 nominations total,https://m.media-amazon.com/images/M/MV5BMTk0NzMzODc2NF5BMl5BanBnXkFtZTgwOTYzNTM1MzE@._V1_SX300.jpg,86,6.8,"261,812",tt2321549,movie,N/A,"$964,413",N/A,N/A,True
