movie_id,title,release_date,original_title,omdb_title,omdb_year,omdb_rated,omdb_released,omdb_runtime,omdb_genre,omdb_director,omdb_writer,omdb_actors,omdb_plot,omdb_language,omdb_country,omdb_awards,omdb_poster,omdb_metascore,omdb_imdb_rating,omdb_imdb_votes,omdb_imdb_id,omdb_type,omdb_dvd,omdb_box_office,omdb_production,omdb_website,omdb_enriched
1,The Shawshank Redemption,1994,The Shawshank Redemption,The Shawshank Redemption,1994,R,14 Oct 1994,142 min,Drama,Frank Darabont,"Stephen King, Frank Darabont","Tim Robbins, Morgan Freeman, Bob Gunton","Chronicles the experiences of a formerly successful banker as a prisoner in the gloomy jailhouse of Shawshank after being found guilty of a crime he did not commit. The film portrays the man's unique way of dealing with his new, torturous life; along the way he befriends a number of fellow prisoners, most notably a wise long-term inmate named Red.",English,United States,Nominated for 7 Oscars. 21 wins & 42 nominations total,https://m.media-amazon.com/images/M/MV5BMDAyY2FhYjctNDc5OS00MDNlLThiMGUtY2UxYWVkNGY2ZjljXkEyXkFqcGc@._V1_SX300.jpg,82,9.3,"3,059,994",tt0111161,movie,N/A,"$28,767,189",N/A,N/A,True
2,The Godfather,1972,The Godfather,The Godfather,1972,R,24 Mar 1972,175 min,"Crime, Drama",Francis Ford Coppola,"Mario Puzo, Francis Ford Coppola","Marlon Brando, Al Pacino, James Caan","The Godfather ""Don"" Vito Corleone is the head of the Corleone mafia family in New York. He is at the event of his daughter's wedding. Michael, Vito's youngest son and a decorated WW II Marine is also present at the wedding. Michael seems to be uninterested in being a part of the family business. Vito is a powerful man, and is kind to all those who give him respect but is ruthless against those who do not. But when a powerful and treacherous rival wants to sell drugs and needs the Don's influence for the same, Vito refuses to do it. What follows is a clash between Vito's fading old values and the new ways which may cause Michael to do the thing he was most reluctant in doing and wage a mob war against all the other mafia families which could tear the Corleone family apart.","English, Italian, Latin",United States,Won 3 Oscars. 31 wins & 31 nominations total,https://m.media-amazon.com/images/M/MV5BNGEwYjgwOGQtYjg5ZS00Njc1LTk2ZGEtM2QwZWQ2NjdhZTE5XkEyXkFqcGc@._V1_SX300.jpg,100,9.2,"2,132,118",tt0068646,movie,N/A,"$136,381,073",N/A,N/A,True
3,The Dark Knight,2008,The Dark Knight,The Dark Knight,2008,PG-13,18 Jul 2008,152 min,"Action, Crime, Drama",Christopher Nolan,"Jonathan Nolan, Christopher Nolan, David S. Goyer","Christian Bale, Heath Ledger, Aaron Eckhart","Set within a year after the events of Batman Begins (2005), Batman, Lieutenant James Gordon, and new District Attorney Harvey Dent successfully begin to round up the criminals that plague Gotham City, until a mysterious and sadistic criminal mastermind known only as ""The Joker"" appears in Gotham, creating a new wave of chaos. Batman's struggle against The Joker becomes deeply personal, forcing him to ""confront everything he believes"" and improve his technology to stop him. A love triangle develops between Bruce Wayne, Dent, and Rachel Dawes.","English, Mandarin","United States, United Kingdom",Won 2 Oscars. 164 wins & 165 nominations total,https://m.media-amazon.com/images/M/MV5BMTMxNTMwODM0NF5BMl5BanBnXkFtZTcwODAyMTk2Mw@@._V1_SX300.jpg,84,9.0,"3,029,887",tt0468569,movie,N/A,"$534,987,076",N/A,N/A,True
4,The Godfather Part II,1974,The Godfather Part II,The Godfather Part II,1974,R,18 Dec 1974,202 min,"Crime, Drama",Francis Ford Coppola,"Francis Ford Coppola, Mario Puzo","Al Pacino, Robert De Niro, Robert Duvall","The continuing saga of the Corleone crime family tells the story of a young Vito Corleone growing up in Sicily and in 1910s New York; and follows Michael Corleone in the 1950s as he attempts to expand the family business into Las Vegas, Hollywood and Cuba.","English, Italian, Spanish, Latin, Sicilian",United States,Won 6 Oscars. 17 wins & 21 nominations total,https://m.media-amazon.com/images/M/MV5BMDIxMzBlZDktZjMxNy00ZGI4LTgxNDEtYWRlNzRjMjJmOGQ1XkEyXkFqcGc@._V1_SX300.jpg,90,9.0,"1,429,496",tt0071562,movie,N/A,"$47,834,595",N/A,N/A,True
5,12 Angry Men,1957,12 Angry Men,12 Angry Men,1957,Approved,10 Apr 1957,96 min,"Crime, Drama",Sidney Lumet,Reginald Rose,"Henry Fonda, Lee J. Cobb, Martin Balsam","The defense and the prosecution have rested, and the jury is filing into the jury room to decide if a young man is guilty or innocent of murdering his father. What begins as an open-and-shut case of murder soon becomes a detective story that presents a succession of clues creating doubt, and a mini-drama of each of the jurors' prejudices and preconceptions about the trial, the accused, AND each other. Based on the play, all of the action takes place on the stage of the jury room.",English,United States,Nominated for 3 Oscars. 16 wins & 12 nominations total,https://m.media-amazon.com/images/M/MV5BYjE4NzdmOTYtYjc5Yi00YzBiLWEzNDEtNTgxZGQ2MWVkN2NiXkEyXkFqcGc@._V1_SX300.jpg,97,9.0,"931,674",tt0050083,movie,N/A,N/A,N/A,N/A,True
6,Schindler's List,1993,Schindler's List,Schindler's List,1993,R,04 Feb 1994,195 min,"Biography, Drama, History",Steven Spielberg,"Thomas Keneally, Steven Zaillian","Liam Neeson, Ralph Fiennes, Ben Kingsley","Oskar Schindler is a vain and greedy German businessman who becomes an unlikely humanitarian amid the barbaric German Nazi reign when he feels compelled to turn his factory into a refuge for Jews. Based on the true story of Oskar Schindler who managed to save about 1100 Jews from being gassed at the Auschwitz concentration camp, it is a testament to the good in all of us.","English, Hebrew, German, Polish, Latin",United States,Won 7 Oscars. 91 wins & 49 nominations total,https://m.media-amazon.com/images/M/MV5BNjM1ZDQxYWUtMzQyZS00MTE1LWJmZGYtNGUyNTdlYjM3ZmVmXkEyXkFqcGc@._V1_SX300.jpg,95,9.0,"1,522,278",tt0108052,movie,N/A,"$96,898,818",N/A,N/A,True
7,The Lord of the Rings: The Return of the King,2003,The Lord of the Rings: The Return of the King,The Lord of the Rings: The Return of the King,2003,PG-13,17 Dec 2003,201 min,"Adventure, Drama, Fantasy",Peter Jackson,"J.R.R. Tolkien, Fran Walsh, Philippa Boyens","Elijah Wood, Viggo Mortensen, Ian McKellen","The final confrontation between the forces of good and evil fighting for control of the future of Middle-earth. Frodo and Sam reach Mordor in their quest to destroy the One Ring, while Aragorn leads the forces of good against Sauron's evil army at the stone city of Minas Tirith.","English, Quenya, Old English, Sindarin","New Zealand, United States",Won 11 Oscars. 215 wins & 124 nominations total,https://m.media-amazon.com/images/M/MV5BMTZkMjBjNWMtZGI5OC00MGU0LTk4ZTItODg2NWM3NTVmNWQ4XkEyXkFqcGc@._V1_SX300.jpg,94,9.0,"2,083,855",tt0167260,movie,N/A,"$381,878,219",N/A,N/A,True
8,Pulp Fiction,1994,Pulp Fiction,Pulp Fiction,1994,R,14 Oct 1994,154 min,"Crime, Drama",Quentin Tarantino,"Quentin Tarantino, Roger Avary","John Travolta, Uma Thurman, Samuel L. Jackson","Jules Winnfield (Samuel L. Jackson) and Vincent Vega (John Travolta) are two hit men who are out to retrieve a suitcase stolen from their employer, mob boss Marsellus Wallace (Ving Rhames). Wallace has also asked Vincent to take his wife Mia (Uma Thurman) out a few days later when Wallace himself will be out of town. Butch Coolidge (Bruce Willis) is an aging boxer who is paid by Wallace to lose his fight. The lives of these seemingly unrelated people are woven together comprising of a series of funny, bizarre and uncalled-for incidents.","English, Spanish, French",United States,Won 1 Oscar. 69 wins & 72 nominations total,https://m.media-amazon.com/images/M/MV5BYTViYTE3ZGQtNDBlMC00ZTAyLTkyODMtZGRiZDg0MjA2YThkXkEyXkFqcGc@._V1_SX300.jpg,95,8.8,"2,342,028",tt0110912,movie,N/A,"$107,928,762",N/A,N/A,True
9,The Lord of the Rings: The Fellowship of the Ring,2001,The Lord of the Rings: The Fellowship of the Ring,The Lord of the Rings: The Fellowship of the Ring,2001,PG-13,19 Dec 2001,178 min,"Adventure, Drama, Fantasy",Peter Jackson,"J.R.R. Tolkien, Fran Walsh, Philippa Boyens","Elijah Wood, Ian McKellen, Orlando Bloom","An ancient Ring thought lost for centuries has been found, and through a strange twist of fate has been given to a small Hobbit named Frodo. When Gandalf discovers the Ring is in fact the One Ring of the Dark Lord Sauron, Frodo must make an epic quest to the Cracks of Doom in order to destroy it. However, he does not go alone. He is joined by Gandalf, Legolas the elf, Gimli the Dwarf, Aragorn, Boromir, and his three Hobbit friends Merry, Pippin, and Samwise. Through mountains, snow, darkness, forests, rivers and plains, facing evil and danger at every corner the Fellowship of the Ring must go. Their quest to destroy the One Ring is the only hope for the end of the Dark Lords reign.","English, Sindarin","New Zealand, United States, United Kingdom",Won 4 Oscars. 125 wins & 126 nominations total,https://m.media-amazon.com/images/M/MV5BNzIxMDQ2YTctNDY4MC00ZTRhLTk4ODQtMTVlOWY4NTdiYmMwXkEyXkFqcGc@._V1_SX300.jpg,92,8.9,"2,114,633",tt0120737,movie,N/A,"$319,372,078",N/A,N/A,True
10,"The Good, the Bad and the Ugly",1966,"The Good, the Bad and the Ugly","The Good, the Bad and the Ugly",1966,R,29 Dec 1967,178 min,"Adventure, Drama, Western",Sergio Leone,"Luciano Vincenzoni, Sergio Leone, Agenore Incrocci","Clint Eastwood, Eli Wallach, Lee Van Cleef","Blondie, The Good (Clint Eastwood), is a professional gunslinger who is out trying to earn a few dollars. Angel Eyes, The Bad (Lee Van Cleef), is a hitman who always commits to a task and sees it through--as long as he's paid to do so. And Tuco, The Ugly (Eli Wallach), is a wanted outlaw trying to take care of his own hide. Tuco and Blondie share a partnership making money off of Tuco's bounty, but when Blondie unties the partnership, Tuco tries to hunt down Blondie. When Blondie and Tuco come across a horse carriage loaded with dead bodies, they soon learn from the only survivor, Bill Carson (Antonio Casale), that he and a few other men have buried a stash of gold in a cemetery. Unfortunately, Carson dies and Tuco only finds out the name of the cemetery, while Blondie finds out the name on the grave. Now the two must keep each other alive in order to find the gold. Angel Eyes (who had been looking for Bill Carson) discovers that Tuco and Blondie met with Carson and knows they know where the gold is; now he needs them to lead him to it. Now The Good, the Bad, and the Ugly must all battle it out to get their hands on $200,000.00 worth of gold.","Italian, English","Italy, Spain, West Germany, United States",2 wins & 5 nominations total,https://m.media-amazon.com/images/M/MV5BMWM5ZjQxM2YtNDlmYi00ZDNhLWI4MWUtN2VkYjBlMTY1ZTkwXkEyXkFqcGc@._V1_SX300.jpg,90,8.8,"857,148",tt0060196,movie,N/A,"$25,100,000",N/A,N/A,True
11,Forrest Gump,1994,Forrest Gump,Forrest Gump,1994,PG-13,06 Jul 1994,142 min,"Drama, Romance",Robert Zemeckis,"Winston Groom, Eric Roth","Tom Hanks, Robin Wright, Gary Sinise","Forrest Gump is a simple man with a low I.Q. but good intentions. He is running through childhood with his best and only friend Jenny. His 'mama' teaches him the ways of life and leaves him to choose his destiny. Forrest joins the army for service in Vietnam, finding new friends called Dan and Bubba, he wins medals, creates a famous shrimp fishing fleet, inspires people to jog, starts a ping-pong craze, creates the smiley, writes bumper stickers and songs, donates to people and meets the president several times. However, this is all irrelevant to Forrest who can only think of his childhood sweetheart Jenny Curran, who has messed up her life. Although in the end all he wants to prove is that anyone can love anyone.",English,United States,Won 6 Oscars. 51 wins & 74 nominations total,https://m.media-amazon.com/images/M/MV5BNDYwNzVjMTItZmU5YS00YjQ5LTljYjgtMjY2NDVmYWMyNWFmXkEyXkFqcGc@._V1_SX300.jpg,82,8.8,"2,386,256",tt0109830,movie,N/A,"$330,455,270",N/A,N/A,True
12,The Lord of the Rings: The Two Towers,2002,The Lord of the Rings: The Two Towers,The Lord of the Rings: The Two Towers,2002,PG-13,18 Dec 2002,179 min,"Adventure, Drama, Fantasy",Peter Jackson,"J.R.R. Tolkien, Fran Walsh, Philippa Boyens","Elijah Wood, Ian McKellen, Viggo Mortensen","The continuing quest of Frodo and the Fellowship to destroy the One Ring. Frodo and Sam discover they are being followed by the mysterious Gollum. Aragorn, the Elf archer Legolas, and Gimli the Dwarf encounter the besieged Rohan kingdom, whose once great King Theoden has fallen under Saruman's deadly spell.","English, Sindarin, Old English","New Zealand, United States",Won 2 Oscars. 132 wins & 138 nominations total,https://m.media-amazon.com/images/M/MV5BMGQxMDdiOWUtYjc1Ni00YzM1LWE2NjMtZTg3Y2JkMjEzMTJjXkEyXkFqcGc@._V1_SX300.jpg,87,8.8,"1,881,081",tt0167261,movie,N/A,"$345,518,923",N/A,N/A,True
13,Fight Club,1999,Fight Club,Fight Club,1999,R,15 Oct 1999,139 min,"Crime, Drama, Thriller",David Fincher,"Chuck Palahniuk, Jim Uhls","Brad Pitt, Edward Norton, Meat Loaf","A nameless first person narrator (Edward Norton) attends support groups in attempt to subdue his emotional state and relieve his insomniac state. When he meets Marla (Helena Bonham Carter), another fake attendee of support groups, his life seems to become a little more bearable. However when he associates himself with Tyler (Brad Pitt) he is dragged into an underground fight club and soap making scheme. Together the two men spiral out of control and engage in competitive rivalry for love and power.",English,"Germany, United States",Nominated for 1 Oscar. 12 wins & 38 nominations total,https://m.media-amazon.com/images/M/MV5BOTgyOGQ1NDItNGU3Ny00MjU3LTg2YWEtNmEyYjBiMjI1Y2M5XkEyXkFqcGc@._V1_SX300.jpg,67,8.8,"2,478,774",tt0137523,movie,N/A,"$37,030,102",N/A,N/A,True
14,Inception,2010,Inception,Inception,2010,PG-13,16 Jul 2010,148 min,"Action, Adventure, Sci-Fi",Christopher Nolan,Christopher Nolan,"Leonardo DiCaprio, Joseph Gordon-Levitt, Elliot Page","Dom Cobb is a skilled thief, the absolute best in the dangerous art of extraction, stealing valuable secrets from deep within the subconscious during the dream state, when the mind is at its most vulnerable. Cobb's rare ability has made him a coveted player in this treacherous new world of corporate espionage, but it has also made him an international fugitive and cost him everything he has ever loved. Now Cobb is being offered a chance at redemption. One last job could give him his life back but only if he can accomplish the impossible, inception. Instead of the perfect heist, Cobb and his team of specialists have to pull off the reverse: their task is not to steal an idea, but to plant one. If they succeed, it could be the perfect crime. But no amount of careful planning or expertise can prepare the team for the dangerous enemy that seems to predict their every move. An enemy that only Cobb could have seen coming.","English, Japanese, French","United States, United Kingdom",Won 4 Oscars. 159 wins & 220 nominations total,https://m.media-amazon.com/images/M/MV5BMjAxMzY3NjcxNF5BMl5BanBnXkFtZTcwNTI5OTM0Mw@@._V1_SX300.jpg,74,8.8,"2,682,985",tt1375666,movie,N/A,"$292,587,330",N/A,N/A,True
15,Star Wars: Episode V - The Empire Strikes Back,1980,Star Wars: Episode V - The Empire Strikes Back,Star Wars: Episode V - The Empire Strikes Back,1980,PG,18 Jun 1980,124 min,"Action, Adventure, Fantasy",Irvin Kershner,"Leigh Brackett, Lawrence Kasdan, George Lucas","Mark Hamill, Harrison Ford, Carrie Fisher","Luke Skywalker, Han Solo, Princess Leia and Chewbacca face attack by the Imperial forces and its AT-AT walkers on the ice planet Hoth. While Han and Leia escape in the Millennium Falcon, Luke travels to Dagobah in search of Yoda. Only with the Jedi Master's help will Luke survive when the Dark Side of the Force beckons him into the ultimate duel with Darth Vader.",English,United States,Won 1 Oscar. 27 wins & 21 nominations total,https://m.media-amazon.com/images/M/MV5BMTkxNGFlNDktZmJkNC00MDdhLTg0MTEtZjZiYWI3MGE5NWIwXkEyXkFqcGc@._V1_SX300.jpg,82,8.7,"1,448,939",tt0080684,movie,N/A,"$292,753,960",N/A,N/A,True
16,The Matrix,1999,The Matrix,The Matrix,1999,R,31 Mar 1999,136 min,"Action, Sci-Fi","Lana Wachowski, Lilly Wachowski","Lilly Wachowski, Lana Wachowski","Keanu Reeves, Laurence Fishburne, Carrie-Anne Moss","Thomas A. Anderson is a man living two lives. By day he is an average computer programmer and by night a hacker known as Neo. Neo has always questioned his reality, but the truth is far beyond his imagination. Neo finds himself targeted by the police when he is contacted by Morpheus, a legendary computer hacker branded a terrorist by the government. As a rebel against the machines, Neo must confront the agents: super-powerful computer programs devoted to stopping Neo and the entire human rebellion.",English,"United States, Australia",Won 4 Oscars. 42 wins & 52 nominations total,https://m.media-amazon.com/images/M/MV5BN2NmN2VhMTQtMDNiOS00NDlhLTliMjgtODE2ZTY0ODQyNDRhXkEyXkFqcGc@._V1_SX300.jpg,73,8.7,"2,162,751",tt0133093,movie,N/A,"$172,076,928",N/A,N/A,True
17,Goodfellas,1990,Goodfellas,Goodfellas,1990,R,21 Sep 1990,145 min,"Biography, Crime, Drama",Martin Scorsese,"Nicholas Pileggi, Martin Scorsese","Robert De Niro, Ray Liotta, Joe Pesci","Henry Hill might be a small time gangster, who may have taken part in a robbery with Jimmy Conway and Tommy De Vito, two other gangsters who might have set their sights a bit higher. His two partners could kill off everyone else involved in the robbery, and slowly start to think about climbing up through the hierarchy of the Mob. Henry, however, might be badly affected by his partners' success, but will he consider stooping low enough to bring about the downfall of Jimmy and Tommy?","English, Italian, Hebrew, Yiddish",United States,Won 1 Oscar. 44 wins & 38 nominations total,https://m.media-amazon.com/images/M/MV5BN2E5NzI2ZGMtY2VjNi00YTRjLWI1MDUtZGY5OWU1MWJjZjRjXkEyXkFqcGc@._V1_SX300.jpg,92,8.7,"1,332,607",tt0099685,movie,N/A,"$46,909,721",N/A,N/A,True
18,One Flew Over the Cuckoo's Nest,1975,One Flew Over the Cuckoo's Nest,One Flew Over the Cuckoo's Nest,1975,R,19 Nov 1975,133 min,Drama,Milos Forman,"Lawrence Hauben, Bo Goldman, Ken Kesey","Jack Nicholson, Louise Fletcher, Michael Berryman","McMurphy has a criminal past and has once again gotten himself into trouble and is sentenced by the court. To escape labor duties in prison, McMurphy pleads insanity and is sent to a ward for the mentally unstable. Once here, McMurphy both endures and stands witness to the abuse and degradation of the oppressive Nurse Ratched, who gains superiority and power through the flaws of the other inmates. McMurphy and the other inmates band together to make a rebellious stance against the atrocious Nurse.",English,United States,Won 5 Oscars. 38 wins & 15 nominations total,https://m.media-amazon.com/images/M/MV5BYjBkMjgzMzYtNzRiMS00NDc3LWE4YTUtZjYxYjZhNjNhYzhhXkEyXkFqcGc@._V1_SX300.jpg,84,8.7,"1,121,711",tt0073486,movie,N/A,"$108,981,275",N/A,N/A,True
19,Se7en,1995,Se7en,Se7en,1995,R,22 Sep 1995,127 min,"Crime, Drama, Mystery",David Fincher,Andrew Kevin Walker,"Morgan Freeman, Brad Pitt, Kevin Spacey","A film about two homicide detectives' (Morgan Freeman and Brad Pitt) desperate hunt for a serial killer who justifies his crimes as absolution for the world's ignorance of the Seven Deadly Sins. The movie takes us from the tortured remains of one victim to the next as the sociopathic ""John Doe"" (Kevin Spacey) sermonizes to Detectives Somerset and Mills -- one sin at a time. The sin of Gluttony comes first and the murderer's terrible capacity is graphically demonstrated in the dark and subdued tones characteristic of film noir. The seasoned and cultured but jaded Somerset researches the Seven Deadly Sins in an effort to understand the killer's modus operandi while the bright but green and impulsive Detective Mills (Pitt) scoffs at his efforts to get inside the mind of a killer...",English,United States,Nominated for 1 Oscar. 29 wins & 44 nominations total,https://m.media-amazon.com/images/M/MV5BY2IzNzMxZjctZjUxZi00YzAxLTk3ZjMtODFjODdhMDU5NDM1XkEyXkFqcGc@._V1_SX300.jpg,65,8.6,"1,918,385",tt0114369,movie,N/A,"$101,040,643",N/A,N/A,True
20,Seven Samurai,1954,Seven Samurai,Seven Samurai,1954,Not Rated,19 Nov 1956,207 min,"Action, Drama",Akira Kurosawa,"Akira Kurosawa, Shinobu Hashimoto, Hideo Oguni","Toshirô Mifune, Takashi Shimura, Keiko Tsushima","A veteran samurai, who has fallen on hard times, answers a village's request for protection from bandits. He gathers 6 other samurai to help him, and they teach the townspeople how to defend themselves, and they supply the samurai with three small meals a day. The film culminates in a giant battle when 40 bandits attack the village.",Japanese,Japan,Nominated for 2 Oscars. 5 wins & 9 nominations total,https://m.media-amazon.com/images/M/MV5BZjliMWExOTMtZDQ3ZS00NWU3LWIyN2EtMjllNzk3ZTNlYzg4XkEyXkFqcGc@._V1_SX300.jpg,98,8.6,"386,001",tt0047478,movie,N/A,"$820,278",N/A,N/A,True
21,The Silence of the Lambs,1991,The Silence of the Lambs,The Silence of the Lambs,1991,R,14 Feb 1991,118 min,"Crime, Drama, Horror",Jonathan Demme,"Thomas Harris, Ted Tally","Jodie Foster, Anthony Hopkins, Scott Glenn","F.B.I. trainee Clarice Starling (Jodie Foster) works hard to advance her career, while trying to hide or put behind her West Virginia roots, of which if some knew, would automatically classify her as being backward or white trash. After graduation, she aspires to work in the agency's Behavioral Science Unit under the leadership of Jack Crawford (Scott Glenn). While she is still a trainee, Crawford asks her to question Dr. Hannibal Lecter (Sir Anthony Hopkins), a psychiatrist imprisoned, thus far, for eight years in maximum security isolation for being a serial killer who cannibalized his victims. Clarice is able to figure out the assignment is to pick Lecter's brains to help them solve another serial murder case, that of someone coined by the media as ""Buffalo Bill"" (Ted Levine), who has so far killed five victims, all located in the eastern U.S., all young women, who are slightly overweight (especially around the hips), all who were drowned in natural bodies of water, and all who were stripped of large swaths of skin. She also figures that Crawford chose her, as a woman, to be able to trigger some emotional response from Lecter. After speaking to Lecter for the first time, she realizes that everything with him will be a psychological game, with her often having to read between the very cryptic lines he provides. She has to decide how much she will play along, as his request in return for talking to him is to expose herself emotionally to him. The case takes a more dire turn when a sixth victim is discovered, this one from who they are able to retrieve a key piece of evidence, if Lecter is being forthright as to its meaning. A potential seventh victim is high profile Catherine Martin (Brooke Smith), the daughter of Senator Ruth Martin (Diane Baker), which places greater scrutiny on the case as they search for a hopefully still alive Catherine. Who may factor into what happens is Dr. Frederick Chilton (Anthony Heald), the warden at the prison, an opportunist who sees the higher profile with Catherine, meaning a higher profile for himself if he can insert himself successfully into the proceedings.","English, Latin",United States,Won 5 Oscars. 71 wins & 50 nominations total,https://m.media-amazon.com/images/M/MV5BNDdhOGJhYzctYzYwZC00YmI2LWI0MjctYjg4ODdlMDExYjBlXkEyXkFqcGc@._V1_SX300.jpg,86,8.6,"1,641,642",tt0102926,movie,N/A,"$130,742,922",N/A,N/A,True
22,It's a Wonderful Life,1946,It's a Wonderful Life,It's a Wonderful Life,1946,PG,07 Jan 1947,130 min,"Drama, Family, Fantasy",Frank Capra,"Frances Goodrich, Albert Hackett, Frank Capra","James Stewart, Donna Reed, Lionel Barrymore","George Bailey has spent his entire life giving of himself to the people of Bedford Falls. He has always longed to travel but never had the opportunity in order to prevent rich skinflint Mr. Potter from taking over the entire town. All that prevents him from doing so is George's modest building and loan company, which was founded by his generous father. But on Christmas Eve, George's Uncle Billy loses the business's $8,000 while intending to deposit it in the bank. Potter finds the misplaced money and hides it from Billy. When the bank examiner discovers the shortage later that night, George realizes that he will be held responsible and sent to jail and the company will collapse, finally allowing Potter to take over the town. Thinking of his wife, their young children, and others he loves will be better off with him dead, he contemplates suicide. But the prayers of his loved ones result in a gentle angel named Clarence coming to earth to help George, with the promise of earning his wings. He shows George what things would have been like if he had never been born.","English, French",United States,Nominated for 5 Oscars. 11 wins & 7 nominations total,https://m.media-amazon.com/images/M/MV5BMDM4OWFhYjEtNTE5Yy00NjcyLTg5N2UtZDQwNDZlYjlmNDU5XkEyXkFqcGc@._V1_SX300.jpg,89,8.6,"526,295",tt0038650,movie,N/A,"$1,483,643",N/A,N/A,True
